title,description,url,image
Todo App,A distraction-free web app to help you focus on creating and completing tasks.,https://dariogalvagno-my-todo-webpage-web-jcoryj.streamlit.app/,1.png
PDF Invoices,A script that reads invoice records from Excel files and automatically generates PDF invoices.,https://github.com/DarioGalvagno/Generate_pdf_invoces_from_excel,4.png
Image Scale Converter,This program allows users to capture a photo and apply a variety of scales/ filters to transform the image,https://photoconvertmadebydariogalvagno.streamlit.app/,11.png
MRZ Checker,A program that check MRZ Line in Passport,https://mrz-checker.streamlit.app/,21.png
The Best Company webpage,This project involves the creation of a professional and engaging webpage for a fictitious company.,https://thebestcompanywebsite.streamlit.app/,22.png
Explore the cosmos: Astronomy Image of the Day,"Dive into the wonders of the universe with our Astronomy Image of the Day feature, powered by NASA’s API. Each day, I showcase a stunning image from the cosmos, accompanied by an insightful description that unravels the beauty and science behind it. Whether you’re an astronomy enthusiast or a curious learner, our page invites you to marvel at the universe’s vastness and discover something new every day!",https://explore-the-cosmos.streamlit.app/,23.png
